{
  "schemaVersion": 1,
  "messageId": "01J8F2K9QS4T7V0X3Z6B8N1M5C",
  "deviceId": "tank-000123",
  "sentAt": "2026-09-14T06:00:12Z",
  "sequence": 4712,
  "measurements": [
    { "type": "level", "value": 1450.0, "unit": "mm", "measuredAt": "2026-09-13T18:00:04Z" },
    { "type": "level", "value": 1444.2, "unit": "mm", "measuredAt": "2026-09-13T22:00:06Z" },
    { "type": "level", "value": 1438.8, "unit": "mm", "measuredAt": "2026-09-14T02:00:09Z", "quality": "uncertain" }
  ],
  "device": {
    "firmware": "1.4.2",
    "battery": { "value": 3.58, "unit": "V" },
    "signal": { "rsrp": -118, "rsrq": -16 }
  }
}
