{
  "schemaVersion": 1,
  "messageId": "01J8F2K9QS4T7V0X3Z6B8N1M5D",
  "sentAt": "2026-09-14T06:00:12Z",
  "measurements": [
    {
      "type": "level",
      "value": 1432.5,
      "unit": "mm",
      "measuredAt": "2026-09-14T06:00:10Z",
      "rawAdcValue": 20481
    }
  ],
  "device": {
    "firmware": "1.5.0",
    "newVendorField": "must be ignored, not rejected"
  }
}
