{
  "schemaVersion": 1,
  "messageId": "01J8F2K9QS4T7V0X3Z6B8N1M6A",
  "deviceId": "charger-000123",
  "sentAt": "2026-09-14T06:00:12Z",
  "sequence": 9021,
  "measurements": [
    { "type": "energy", "value": 48211.37, "unit": "kW.h", "measuredAt": "2026-09-14T06:00:00Z" },
    { "type": "power", "value": 21.8, "unit": "kW", "measuredAt": "2026-09-14T06:00:00Z" },
    { "type": "count", "value": 1873, "unit": "1", "sensor": "sessions", "measuredAt": "2026-09-14T06:00:00Z" }
  ],
  "device": {
    "firmware": "2.1.0",
    "signal": { "rsrp": -96, "rsrq": -9 }
  }
}
